date;year;month;day;so2;no;no2;co;pm10;o3;pm2.5;ben;week;startDate;endDate;weekOrder
01/01/2014 00:00;2014;1;1;6;21;33;0.5;33;22;16;0.7;0;-;-;0
02/01/2014 00:00;2014;1;2;10;33;47;0.57;50;23;19;0.9;0;-;-;0
03/01/2014 00:00;2014;1;3;11;17;42;0.41;49;26;15;0.7;0;-;-;0
04/01/2014 00:00;2014;1;4;12;5;25;0.66;38;45;11;0.2;0;-;-;0
05/01/2014 00:00;2014;1;5;9;15;34;0.21;40;31;13;0.6;0;-;-;0
06/01/2014 00:00;2014;1;6;7;11;24;0.27;34;39;12;0.5;1;2014 1 6;2014 1 12;1
07/01/2014 00:00;2014;1;7;7;29;45;0.38;54;9;21;1;1;-;-;1
08/01/2014 00:00;2014;1;8;6;49;42;0.71;63;23;16;0.6;1;-;-;1
09/01/2014 00:00;2014;1;9;5;7;34;0.21;25;34;12;0.3;1;-;-;1
10/01/2014 00:00;2014;1;10;8;12;30;0.33;26;25;15;0.4;1;-;-;1
11/01/2014 00:00;2014;1;11;7;7;31;0.28;21;28;12;0.4;1;-;-;1
12/01/2014 00:00;2014;1;12;10;23;37;0.48;49;14;22;1;1;-;-;1
13/01/2014 00:00;2014;1;13;8;13;32;0.36;43;37;9;0.3;2;2014 1 13;2014 1 19;2
14/01/2014 00:00;2014;1;14;5;9;33;0.43;21;35;10;0.3;2;-;-;2
15/01/2014 00:00;2014;1;15;9;41;42;0.79;53;16;18;0.8;2;-;-;2
16/01/2014 00:00;2014;1;16;11;13;34;0.37;35;36;11;0.4;2;-;-;2
17/01/2014 00:00;2014;1;17;8;29;42;0.46;88;26;13;1;2;-;-;2
18/01/2014 00:00;2014;1;18;7;10;38;0.41;45;27;12;0.7;2;-;-;2
19/01/2014 00:00;2014;1;19;4;3;16;0.38;16;47;8;0.3;2;-;-;2
20/01/2014 00:00;2014;1;20;6;10;39;0.41;26;33;9;0.4;3;2014 1 20;2014 1 26;3
21/01/2014 00:00;2014;1;21;13;26;47;0.56;34;18;16;0.6;3;-;-;3
22/01/2014 00:00;2014;1;22;11;8;33;0.37;29;35;12;0.3;3;-;-;3
23/01/2014 00:00;2014;1;23;5;6;28;0.29;31;40;11;0.3;3;-;-;3
24/01/2014 00:00;2014;1;24;7;5;27;0.34;33;39;11;0.3;3;-;-;3
25/01/2014 00:00;2014;1;25;7;5;24;0.36;23;32;10;0.3;3;-;-;3
26/01/2014 00:00;2014;1;26;13;6;23;0.66;35;29;10;0.3;3;-;-;3
27/01/2014 00:00;2014;1;27;15;5;25;0.51;38;48;9;0.1;4;2014 1 27;2014 2 2;4
28/01/2014 00:00;2014;1;28;11;5;23;0.61;31;49;8;0.1;4;-;-;4
29/01/2014 00:00;2014;1;29;9;7;31;0.56;27;41;9;0.3;4;-;-;4
30/01/2014 00:00;2014;1;30;10;6;31;0.38;28;38;10;0.2;4;-;-;4
31/01/2014 00:00;2014;1;31;8;15;42;0.4;36;28;14;0.6;4;-;-;4
01/02/2014 0:00;2014;2;1;12;4;19;0.45;35;52;9;0.2;4;-;-;4
02/02/2014 0:00;2014;2;2;6;4;22;0.34;33;44;11;0.4;4;-;-;4
03/02/2014 0:00;2014;2;3;15;6;28;0.44;34;42;7;0.2;5;2014 2 3;2014 2 9;1
04/02/2014 0:00;2014;2;4;9;19;31;0.4;33;37;9;0.4;5;-;-;1
05/02/2014 0:00;2014;2;5;18;15;35;0.59;50;35;8.5;0.35;5;-;-;1
06/02/2014 0:00;2014;2;6;9;4;17;0.36;35;46;8;0.3;5;-;-;1
07/02/2014 0:00;2014;2;7;10;17;39;0.43;34;38;11;0.4;5;-;-;1
08/02/2014 0:00;2014;2;8;16;4;20;0.53;37;52;8;0.2;5;-;-;1
09/02/2014 0:00;2014;2;9;7;7;32;0.28;37;39;10;0.4;5;-;-;1
10/02/2014 0:00;2014;2;10;9;9;30;0.36;28;43;11;0.2;6;2014 2 10;2014 2 16;2
11/02/2014 0:00;2014;2;11;7;20;43;0.4;32;30;13;0.4;6;-;-;2
12/02/2014 0:00;2014;2;12;10;31;49;0.6;44;15;20;0.7;6;-;-;2
13/02/2014 0:00;2014;2;13;8;6;25;0.29;37;42;11;0.3;6;-;-;2
14/02/2014 0:00;2014;2;14;16;27;32;0.72;57;30;17;0.7;6;-;-;2
15/02/2014 0:00;2014;2;15;8;4;18;0.32;24;52;8;0.2;6;-;-;2
16/02/2014 0:00;2014;2;16;4;3;21;0.17;20;42;10;0.3;6;-;-;2
17/02/2014 0:00;2014;2;17;8;21;49;0.46;52;22;17;0.7;7;2014 2 17;2014 2 23;3
18/02/2014 0:00;2014;2;18;8;13;38;0.4;44;24;17;0.6;7;-;-;3
19/02/2014 0:00;2014;2;19;9;14;43;0.42;42;20;18;0.5;7;-;-;3
20/02/2014 0:00;2014;2;20;12;12;33;1.11;48;28;21;0.6;7;-;-;3
21/02/2014 0:00;2014;2;21;15;6;30;0.51;33;43;8;0.2;7;-;-;3
22/02/2014 0:00;2014;2;22;7;4;29;0.35;35;35;13;0.4;7;-;-;3
23/02/2014 0:00;2014;2;23;10;8;34;0.78;63;19;27;0.9;7;-;-;3
24/02/2014 0:00;2014;2;24;11;14;43;0.59;63;23;20;0.7;8;2014 2 24;2014 2 30;4
25/02/2014 0:00;2014;2;25;11;14;33;0.69;42;36;12;0.4;8;-;-;4
26/02/2014 0:00;2014;2;26;7;12;35;0.4;34;37;13;0.4;8;-;-;4
27/02/2014 0:00;2014;2;27;9;5;25;0.34;43;42;14;0.3;8;-;-;4
28/02/2014 0:00;2014;2;28;19;6;26;0.56;46;44;12;0.2;8;-;-;4
29/02/2014 0:00;2014;2;29;15.5;6.25;26.5;0.5;39.5;40.25;11.75;0.225;8;-;-;4
30/02/2014 0:00;2014;2;30;12;6.5;27;0.44;33;36.5;11.5;0.25;8;-;-;4
31/02/2014 0:00;2014;2;31;8.5;6.75;27.5;0.38;26.5;32.75;11.25;0.275;9;2014 2 31;2014 3 6;1
01/03/2014 0:00;2014;3;1;5;7;28;0.32;20;29;11;0.3;9;-;-;1
02/03/2014 0:00;2014;3;2;4;7;20;0.18;22;33;10;0.3;9;-;-;1
03/03/2014 0:00;2014;3;3;10;5;20;0.57;36;50;11;0.2;9;-;-;1
04/03/2014 0:00;2014;3;4;15;3;21;0.56;30;40;7;0.2;9;-;-;1
05/03/2014 0:00;2014;3;5;9;6;21;0.18;28;43;11;0.2;9;-;-;1
06/03/2014 0:00;2014;3;6;8;10;31;0.22;32;29;15;0.3;9;-;-;1
07/03/2014 0:00;2014;3;7;7;10;33;0.3;40;20;24;0.5;10;2014 3 7;2014 3 13;2
08/03/2014 0:00;2014;3;8;9;10;37;0.57;49;18;23;0.7;10;-;-;2
09/03/2014 0:00;2014;3;9;8;22;49;0.57;66;25;25;0.8;10;-;-;2
10/03/2014 0:00;2014;3;10;28;11;48;0.89;72;26;26;0.6;10;-;-;2
11/03/2014 0:00;2014;3;11;9;6;33;0.46;42;48;28;0.3;10;-;-;2
12/03/2014 0:00;2014;3;12;6;4;33;0.25;64;45;39;0.4;10;-;-;2
13/03/2014 0:00;2014;3;13;14;12;41;0.72;92;30;57;1.2;10;-;-;2
14/03/2014 0:00;2014;3;14;11;15;39;0.55;78;34;63;1.2;11;2014 3 14;2014 3 20;3
15/03/2014 0:00;2014;3;15;9;4;32;0.42;65;51;32;0.3;11;-;-;3
16/03/2014 0:00;2014;3;16;5;2;18;0.18;48;57;25;0.4;11;-;-;3
17/03/2014 0:00;2014;3;17;8;10;30;0.25;44;41;17;0.2;11;-;-;3
18/03/2014 0:00;2014;3;18;7;6;27;0.19;31;51;12;0.2;11;-;-;3
19/03/2014 0:00;2014;3;19;4;4;24;0.19;29;44;23;0.4;11;-;-;3
20/03/2014 0:00;2014;3;20;14;11;32;0.38;53;31;18;0.4;11;-;-;3
21/03/2014 0:00;2014;3;21;8;5;35;0.31;31;33;9;0.2;12;2014 3 21;2014 3 27;4
22/03/2014 0:00;2014;3;22;17;4;21;0.48;35;51;9;0.2;12;-;-;4
23/03/2014 0:00;2014;3;23;7;3;20;0.19;23;52;13;0.4;12;-;-;4
24/03/2014 0:00;2014;3;24;6;12;33;0.59;37;32;9;0.1;12;-;-;4
25/03/2014 0:00;2014;3;25;9;4;15;0.35;34;57;9;0.2;12;-;-;4
26/03/2014 0:00;2014;3;26;7;5;20;0.17;27;49;8;0.2;12;-;-;4
27/03/2014 0:00;2014;3;27;8;5;23;0.2;21;50;13;0.3;12;-;-;4
28/03/2014 0:00;2014;3;28;6;8;26;0.3;34;39;18;0.4;13;2014 3 28;2014 4 3;1
29/03/2014 0:00;2014;3;29;7;4;29;0.23;33;35;16;0.5;13;-;-;1
30/03/2014 0:00;2014;3;30;5;3;23;0.22;28;35;11;0.4;13;-;-;1
31/03/2014 0:00;2014;3;31;6;13;32;0.25;37;35;8;0.4;13;-;-;1
01/04/2014 0:00;2014;4;1;6;16;32;0.28;18;46;7;0.2;13;-;-;1
02/04/2014 0:00;2014;4;2;4;4;26;0.19;17;45;10;0.4;13;-;-;1
03/04/2014 0:00;2014;4;3;3;5;25;0.28;20;39;14;0.5;13;-;-;1
04/04/2014 0:00;2014;4;4;3;12;38;0.43;30;22;36;0.3;14;2014 4 4;2014 4 10;2
05/04/2014 0:00;2014;4;5;5;5;28;0.49;29;24;17;0.4;14;-;-;2
06/04/2014 0:00;2014;4;6;7;6;23;0.44;34;27;13;0.5;14;-;-;2
07/04/2014 0:00;2014;4;7;8;16;30;0.42;44;28;8;0.2;14;-;-;2
08/04/2014 0:00;2014;4;8;4;3;18;0.15;21;51;10;0.1;14;-;-;2
09/04/2014 0:00;2014;4;9;5;3;16;0.17;33;54;16;0.3;14;-;-;2
10/04/2014 0:00;2014;4;10;4;12;27;0.33;43;39;10;0.1;14;-;-;2
11/04/2014 0:00;2014;4;11;3;3;16;0.17;29;58;14;0.1;15;2014 4 11;2014 4 17;3
12/04/2014 0:00;2014;4;12;3;2;12;0.17;32;64;18;0.1;15;-;-;3
13/04/2014 0:00;2014;4;13;3;2;12;0.19;42;61;17;0.1;15;-;-;3
14/04/2014 0:00;2014;4;14;4;3;14;0.15;38;63;16;0.2;15;-;-;3
15/04/2014 0:00;2014;4;15;4;3;19;0.17;43;47;25;0.4;15;-;-;3
16/04/2014 0:00;2014;4;16;3;14;27;0.46;56;38;28;0.4;15;-;-;3
17/04/2014 0:00;2014;4;17;5;2;17;0.21;38;53;18;0.2;15;-;-;3
18/04/2014 0:00;2014;4;18;4;2;13;0.22;27;58;18;0.2;16;2014 4 18;2014 4 24;4
19/04/2014 0:00;2014;4;19;4;3;23;0.25;35;51;12;0.2;16;-;-;4
20/04/2014 0:00;2014;4;20;5;2;15;0.21;18;46;11;0.2;16;-;-;4
21/04/2014 0:00;2014;4;21;6;7;22;0.33;22;43;13;0.2;16;-;-;4
22/04/2014 0:00;2014;4;22;5;4;24;0.19;26;44;12;0.2;16;-;-;4
23/04/2014 0:00;2014;4;23;6;6;25;0.25;31;49;10;0.2;16;-;-;4
24/04/2014 0:00;2014;4;24;10;6;27;0.42;32;46;10;0.2;16;-;-;4
25/04/2014 0:00;2014;4;25;7;4;26;0.23;19;48;9;0.2;17;2014 4 25;2014 4 31;1
26/04/2014 0:00;2014;4;26;8;3;17;0.32;32;51;8;0.2;17;-;-;1
27/04/2014 0:00;2014;4;27;16;3;16;0.56;30;50;9;0.2;17;-;-;1
28/04/2014 0:00;2014;4;28;6;7;18;0.2;19;33;10;0.2;17;-;-;1
29/04/2014 0:00;2014;4;29;5;6;19;0.21;19;31;12;0.3;17;-;-;1
30/04/2014 0:00;2014;4;30;6;7;23;0.25;24;29;8;0.2;17;-;-;1
31/04/2014 0:00;2014;4;31;6;4.5;16.5;0.195;19.5;38;7.5;0.2;17;-;-;1
01/05/2014 0:00;2014;5;1;6;2;10;0.14;15;47;7;0.2;18;2014 5 1;2014 5 7;2
02/05/2014 0:00;2014;5;2;6;4;16;0.19;16;49;7;0.1;18;-;-;2
03/05/2014 0:00;2014;5;3;5;2;10;0.17;17;54;10;0.1;18;-;-;2
04/05/2014 0:00;2014;5;4;6;2;11;0.2;24;64;19;0.4;18;-;-;2
05/05/2014 0:00;2014;5;5;12;10;29;0.71;48;35;17;0.3;18;-;-;2
06/05/2014 0:00;2014;5;6;7;10;28;0.26;43;31;13;0.3;18;-;-;2
07/05/2014 0:00;2014;5;7;9;8;22;0.2;34;38;10;0.2;18;-;-;2
08/05/2014 0:00;2014;5;8;5;4;18;0.19;31;41;11;0.3;19;2014 5 8;2014 5 14;3
09/05/2014 0:00;2014;5;9;5;6;19;0.18;23;27;13;0.2;19;-;-;3
10/05/2014 0:00;2014;5;10;11;6;19;0.26;28;28;7;0.1;19;-;-;3
11/05/2014 0:00;2014;5;11;7;2;11;0.2;25;53;8;0.1;19;-;-;3
12/05/2014 0:00;2014;5;12;4;4;16;0.18;25;51;9;0.2;19;-;-;3
13/05/2014 0:00;2014;5;13;4;4;17;0.21;23;51;8;0.1;19;-;-;3
14/05/2014 0:00;2014;5;14;3;6;15;0.2;49;52;12;0.1;19;-;-;3
15/05/2014 0:00;2014;5;15;4;2;11;0.16;32;64;12;0.1;20;2014 5 15;2014 5 21;4
16/05/2014 0:00;2014;5;16;4;3;13;0.17;33;65;13;0.2;20;-;-;4
17/05/2014 0:00;2014;5;17;5;3;15;0.35;29;56;14;0.2;20;-;-;4
18/05/2014 0:00;2014;5;18;6;2;18;0.45;37;60;16;0.3;20;-;-;4
19/05/2014 0:00;2014;5;19;3;5;25;0.24;29;60;8;0.2;20;-;-;4
20/05/2014 0:00;2014;5;20;4;6;21;0.23;21;46;8;0.2;20;-;-;4
21/05/2014 0:00;2014;5;21;5;7;24;0.25;23;48;8;0.2;20;-;-;4
22/05/2014 0:00;2014;5;22;8;4;24;0.49;24;41;9;0.2;21;2014 5 22;2014 5 28;1
23/05/2014 0:00;2014;5;23;9;5;21;0.52;31;46;9;0.1;21;-;-;1
24/05/2014 0:00;2014;5;24;8;4;17;0.16;22;51;8;0.1;21;-;-;1
25/05/2014 0:00;2014;5;25;5;2;13;0.15;16;50;10;0.2;21;-;-;1
26/05/2014 0:00;2014;5;26;7;6;23;0.21;24;45;10;0.3;21;-;-;1
27/05/2014 0:00;2014;5;27;5;4;18;0.24;22;47;12;0.2;21;-;-;1
28/05/2014 0:00;2014;5;28;5;7;25;0.27;29;31;13;0.3;21;-;-;1
29/05/2014 0:00;2014;5;29;8;11;28;0.32;28;24;9;0.2;22;2014 5 29;2014 6 4;2
30/05/2014 0:00;2014;5;30;4;5;19;0.22;18;37;11;0.2;22;-;-;2
31/05/2014 0:00;2014;5;31;3;3;16;0.19;21;41;13;0.2;22;-;-;2
01/06/2014 0:00;2014;6;1;7;3;13;0.54;25;47;11;0.1;22;-;-;2
02/06/2014 0:00;2014;6;2;2;2;12;0.17;19;59;14;0.2;22;-;-;2
03/06/2014 0:00;2014;6;3;3;4;20;0.19;24;43;9;0.2;22;-;-;2
04/06/2014 0:00;2014;6;4;5;5;17;0.22;26;47;10;0.2;22;-;-;2
05/06/2014 0:00;2014;6;5;5;8;20;0.15;29;44;15;0.3;23;2014 6 5;2014 6 11;3
06/06/2014 0:00;2014;6;6;11;21;33;0.38;41;39;10;0.2;23;-;-;3
07/06/2014 0:00;2014;6;7;8;2;17;0.2;28;51;12;0.3;23;-;-;3
08/06/2014 0:00;2014;6;8;12;3;19;0.35;25;42;8;0.2;23;-;-;3
09/06/2014 0:00;2014;6;9;11;7;20;0.34;27;41;8;0.1;23;-;-;3
10/06/2014 0:00;2014;6;10;5;4;15;0.14;25;43;9;0.1;23;-;-;3
11/06/2014 0:00;2014;6;11;6;4;11;0.15;28;44;14;0.2;23;-;-;3
12/06/2014 0:00;2014;6;12;5;3;12;0.13;30;48;20;0.1;24;2014 6 12;2014 6 18;4
13/06/2014 0:00;2014;6;13;5;6;21;0.31;40;55;18;0.1;24;-;-;4
14/06/2014 0:00;2014;6;14;8;2;12;0.19;40;69;13;0.1;24;-;-;4
15/06/2014 0:00;2014;6;15;8;2;12;0.27;32;55;12;0.1;24;-;-;4
16/06/2014 0:00;2014;6;16;3;5;16;0.18;34;58;12;0.2;24;-;-;4
17/06/2014 0:00;2014;6;17;4;5;17;0.22;40;60;13;0.1;24;-;-;4
18/06/2014 0:00;2014;6;18;3;5;14;0.15;36;65;16;0.1;24;-;-;4
19/06/2014 0:00;2014;6;19;3;2;13;0.18;35;70;22;0.3;25;2014 6 19;2014 6 25;1
20/06/2014 0:00;2014;6;20;3;4;23;0.15;50;60;16;0.2;25;-;-;1
21/06/2014 0:00;2014;6;21;2;2;16;0.17;38;62;18;0.2;25;-;-;1
22/06/2014 0:00;2014;6;22;3;2;17;0.25;38;53;29;0.3;25;-;-;1
23/06/2014 0:00;2014;6;23;5;5;23;0.13;46;57;26;0.3;25;-;-;1
24/06/2014 0:00;2014;6;24;4;4;22;0.13;45;59;19;0.1;25;-;-;1
25/06/2014 0:00;2014;6;25;5;5;22;0.15;38;63;15;0.2;25;-;-;1
26/06/2014 0:00;2014;6;26;7;4;18;0.15;27;55;10;0.1;26;2014 6 26;2014 7 1;2
27/06/2014 0:00;2014;6;27;5;5;18;0.14;22;39;11;0.1;26;-;-;2
28/06/2014 0:00;2014;6;28;7;6;16;0.21;26;35;9;0.1;26;-;-;2
29/06/2014 0:00;2014;6;29;9;4;14;0.19;21;38;14;0.1;26;-;-;2
30/06/2014 0:00;2014;6;30;5;3;14;0.21;28;45;12;0.1;26;-;-;2
31/06/2014 0:00;2014;6;31;4.5;4.5;17;0.205;26.5;41;10;0.1;26;-;-;2
01/07/2014 0:00;2014;7;1;4;6;20;0.2;25;37;8;0.1;26;-;-;2
02/07/2014 0:00;2014;7;2;3;6;18;0.14;19;38;10;0.1;27;2014 7 2;2014 7 8;3
03/07/2014 0:00;2014;7;3;4;7;16;0.15;27;38;17;0.2;27;-;-;3
04/07/2014 0:00;2014;7;4;6;5;24;0.19;42;47;14;0.1;27;-;-;3
05/07/2014 0:00;2014;7;5;6;5;17;0.18;38;34;11;0.1;27;-;-;3
06/07/2014 0:00;2014;7;6;7;4;17;0.14;27;40;9;0.2;27;-;-;3
07/07/2014 0:00;2014;7;7;5;5;19;0.23;26;42;10;0.2;27;-;-;3
08/07/2014 0:00;2014;7;8;3;5;19;0.15;21;37;9;0.1;27;-;-;3
09/07/2014 0:00;2014;7;9;5;4;15;0.23;30;40;9;0.1;28;2014 7 9;2014 7 15;4
10/07/2014 0:00;2014;7;10;9;8;17;0.26;25;36;9;0.1;28;-;-;4
11/07/2014 0:00;2014;7;11;12;6;16;0.2;19;34;9;0.1;28;-;-;4
12/07/2014 0:00;2014;7;12;7;3;10;0.15;15;41;11;0.1;28;-;-;4
13/07/2014 0:00;2014;7;13;5;3;12;0.2;23;37;10;0.2;28;-;-;4
14/07/2014 0:00;2014;7;14;3;5;15;0.17;20;36;10;0.1;28;-;-;4
15/07/2014 0:00;2014;7;15;3;3;13;0.15;21;46;10;0.1;28;-;-;4
16/07/2014 0:00;2014;7;16;3;3;12;0.11;21;48;18;0.2;29;2014 7 16;2014 7 22;1
17/07/2014 0:00;2014;7;17;4;6;19;0.25;37;56;10;0.1;29;-;-;1
18/07/2014 0:00;2014;7;18;3;3;14;0.13;22;48;13;0.2;29;-;-;1
19/07/2014 0:00;2014;7;19;5;6;21;0.33;39;36;8;0.1;29;-;-;1
20/07/2014 0:00;2014;7;20;7;3;13;0.23;24;38;10;0.2;29;-;-;1
21/07/2014 0:00;2014;7;21;3;6;17;0.23;22;35;8;0.1;29;-;-;1
22/07/2014 0:00;2014;7;22;4;5;11;0.15;20;40;12;0.2;29;-;-;1
23/07/2014 0:00;2014;7;23;6;4;13;0.13;23;51;14;0.2;30;2014 7 23;2014 7 29;2
24/07/2014 0:00;2014;7;24;5;6;21;0.21;45;60;19;0.2;30;-;-;2
25/07/2014 0:00;2014;7;25;2;4;24;0.25;39;64;17;0.1;30;-;-;2
26/07/2014 0:00;2014;7;26;3;1;9;0.17;26;94;15;0.1;30;-;-;2
27/07/2014 0:00;2014;7;27;3;2;11;0.15;24;72;15;0.4;30;-;-;2
28/07/2014 0:00;2014;7;28;3;4;20;0.2;35;48;8;0.2;30;-;-;2
29/07/2014 0:00;2014;7;29;2;4;17;0.19;23;46;9;0.2;30;-;-;2
30/07/2014 0:00;2014;7;30;2;6;16;0.2;28;45;10;0.1;31;2014 7 30;2014 8 5;3
31/07/2014 0:00;2014;7;31;3;2;11;0.16;19;62;10;0.2;31;-;-;3
01/08/2014 0:00;2014;8;1;5;6;23;0.21;21;50;15;0.3;31;-;-;3
02/08/2014 0:00;2014;8;2;5;6;24;0.38;27;28;9;0.2;31;-;-;3
03/08/2014 0:00;2014;8;3;5;4;21;0.24;20;34;12;0.3;31;-;-;3
04/08/2014 0:00;2014;8;4;4;8;18;0.29;23;37;14;0.3;31;-;-;3
05/08/2014 0:00;2014;8;5;6;9;20;0.36;31;42;13;0.2;31;-;-;3
06/08/2014 0:00;2014;8;6;5;6;21;0.41;27;42;11;0.3;32;2014 8 6;2014 8 12;4
07/08/2014 0:00;2014;8;7;3;6;17;0.17;20;33;10;0.2;32;-;-;4
08/08/2014 0:00;2014;8;8;2;9;19;0.16;21;30;6;0.1;32;-;-;4
09/08/2014 0:00;2014;8;9;5;3;14;0.14;13;46;6;0.1;32;-;-;4
10/08/2014 0:00;2014;8;10;5;5;21;0.62;23;30;8;0.3;32;-;-;4
11/08/2014 0:00;2014;8;11;4;4;17;0.18;21;45;10;0.2;32;-;-;4
12/08/2014 0:00;2014;8;12;7;7;19;0.27;34;41;8;0.1;32;-;-;4
13/08/2014 0:00;2014;8;13;9;5;20;0.51;30;45;8;0.2;33;2014 8 13;2014 8 19;1
14/08/2014 0:00;2014;8;14;10;7;22;0.26;22;40;7;0.1;33;-;-;1
15/08/2014 0:00;2014;8;15;7;3;13;0.23;15;54;9;0.1;33;-;-;1
16/08/2014 0:00;2014;8;16;5;3;12;0.2;18;58;9;0.1;33;-;-;1
17/08/2014 0:00;2014;8;17;4;2;10;0.15;18;57;10;0.2;33;-;-;1
18/08/2014 0:00;2014;8;18;4;7;18;0.25;23;44;8;0.1;33;-;-;1
19/08/2014 0:00;2014;8;19;5;5;16;0.18;20;52;7;0.1;33;-;-;1
20/08/2014 0:00;2014;8;20;3;5;21;0.19;18;44;8;0.1;34;2014 8 20;2014 8 26;2
21/08/2014 0:00;2014;8;21;3;8;17;0.24;20;45;8;0.1;34;-;-;2
22/08/2014 0:00;2014;8;22;5;5;17;0.19;15;51;7;0.1;34;-;-;2
23/08/2014 0:00;2014;8;23;4;2;13;0.19;13;49;10;0.1;34;-;-;2
24/08/2014 0:00;2014;8;24;8;3;14;0.19;19;49;14;0.3;34;-;-;2
25/08/2014 0:00;2014;8;25;8;7;25;0.29;27;42;9;0.2;34;-;-;2
26/08/2014 0:00;2014;8;26;3;7;19;0.21;22;27;10;0.2;34;-;-;2
27/08/2014 0:00;2014;8;27;3;9;16;0.17;22;27;9;0.1;35;2014 8 27;2014 9 2;3
28/08/2014 0:00;2014;8;28;6;5;22;0.25;22;39;10;0.2;35;-;-;3
29/08/2014 0:00;2014;8;29;5;7;17;0.35;22;38;8;0.1;35;-;-;3
30/08/2014 0:00;2014;8;30;5;3;11;0.19;26;50;8;0.1;35;-;-;3
31/08/2014 0:00;2014;8;31;4;2;10;0.17;23;51;9;0.1;35;-;-;3
01/09/2014 0:00;2014;9;1;5;4;12;0.17;24;58;13;0.3;35;-;-;3
02/09/2014 0:00;2014;9;2;6;9;16;0.24;49;62;14;0.5;35;-;-;3
03/09/2014 0:00;2014;9;3;4;10;27;0.4;50;55;17;0.5;36;2014 9 3;2014 9 9;4
04/09/2014 0:00;2014;9;4;2;4;22;0.19;48;55;15;0.1;36;-;-;4
05/09/2014 0:00;2014;9;5;3;6;18;0.27;31;51;17;0.1;36;-;-;4
06/09/2014 0:00;2014;9;6;7;6;21;0.48;36;52;16;0.1;36;-;-;4
07/09/2014 0:00;2014;9;7;10;5;23;0.28;38;41;14;0.1;36;-;-;4
08/09/2014 0:00;2014;9;8;6;6;18;0.2;24;41;16;0.3;36;-;-;4
09/09/2014 0:00;2014;9;9;5;9;19;0.29;30;45;21;0.5;36;-;-;4
10/09/2014 0:00;2014;9;10;4;4;25;0.22;37;51;24;0.7;37;2014 9 10;2014 9 16;1
11/09/2014 0:00;2014;9;11;3;7;26;0.45;42;52;25;0.5;37;-;-;1
12/09/2014 0:00;2014;9;12;3;9;22;0.22;40;57;25;0.5;37;-;-;1
13/09/2014 0:00;2014;9;13;2;5;24;0.86;51;54;22;0.5;37;-;-;1
14/09/2014 0:00;2014;9;14;5;5;26;0.38;37;32;13;0.5;37;-;-;1
15/09/2014 0:00;2014;9;15;6;12;26;0.39;30;42;14;0.8;37;-;-;1
16/09/2014 0:00;2014;9;16;6;20;42;0.33;31;27;11;0.5;37;-;-;1
17/09/2014 0:00;2014;9;17;4;27;36;0.26;37;36;14;1;38;2014 9 17;2014 9 23;2
18/09/2014 0:00;2014;9;18;3;12;34;0.35;56;33;9;0.4;38;-;-;2
19/09/2014 0:00;2014;9;19;4;6;31;0.23;28;42;11;0.4;38;-;-;2
20/09/2014 0:00;2014;9;20;5;4;23;0.42;28;39;12;0.3;38;-;-;2
21/09/2014 0:00;2014;9;21;3;4;19;1.04;31;50;11;0.4;38;-;-;2
22/09/2014 0:00;2014;9;22;3;11;31;0.18;35;43;20;0.3;38;-;-;2
23/09/2014 0:00;2014;9;23;2;4;21;0.19;36;57;32;0.6;38;-;-;2
24/09/2014 0:00;2014;9;24;6;25;35;0.35;52;40;33;0.4;39;2014 9 24;2014 9 30;3
25/09/2014 0:00;2014;9;25;6;13;28;0.6;56;32;22;0.4;39;-;-;3
26/09/2014 0:00;2014;9;26;9;35;30;0.56;50;37;25;0.6;39;-;-;3
27/09/2014 0:00;2014;9;27;7;7;27;0.42;51;39;20;0.3;39;-;-;3
28/09/2014 0:00;2014;9;28;8;3;28;0.5;35;40;17;0.3;39;-;-;3
29/09/2014 0:00;2014;9;29;8;19;34;0.9;38;33;20;0.4;39;-;-;3
30/09/2014 0:00;2014;9;30;5;15;30;0.6;37;28;17;0.3;39;-;-;3
31/09/2014 0:00;2014;9;31;4;12;27;0.55;34.5;34.5;16.5;0.4;40;2014 9 31;2014 10 6;4
01/10/2014 0:00;2014;10;1;3;9;24;0.5;32;41;16;0.5;40;-;-;4
02/10/2014 0:00;2014;10;2;4;12;24;0.18;32;36;23;0.6;40;-;-;4
03/10/2014 0:00;2014;10;3;3;16;29;0.41;33;33;20;0.5;40;-;-;4
04/10/2014 0:00;2014;10;4;3;6;27;0.41;42;35;9;0.2;40;-;-;4
05/10/2014 0:00;2014;10;5;3;2;16;0.25;23;52;13;0.4;40;-;-;4
06/10/2014 0:00;2014;10;6;8;17;31;0.79;34;19;14;0.5;40;-;-;4
07/10/2014 0:00;2014;10;7;10;14;36;0.61;34;21;17;0.8;41;2014 10 7;2014 10 13;1
08/10/2014 0:00;2014;10;8;6;16;35;1.03;36;18;16;0.3;41;-;-;1
09/10/2014 0:00;2014;10;9;5;10;31;0.15;31;26;19;0.5;41;-;-;1
10/10/2014 0:00;2014;10;10;8;16;30;0.14;33;17;19;0.4;41;-;-;1
11/10/2014 0:00;2014;10;11;11;11;26;0.36;35;24;18;0.3;41;-;-;1
12/10/2014 0:00;2014;10;12;7;3;21;0.21;31;35;12;0.2;41;-;-;1
13/10/2014 0:00;2014;10;13;5;2;17;0.11;20;50;16;0.6;41;-;-;1
14/10/2014 0:00;2014;10;14;6;15;34;0.17;34;24;17;0.5;42;2014 10 14;2014 10 20;2
15/10/2014 0:00;2014;10;15;4;24;42;0.81;34;12;14;0.6;42;-;-;2
16/10/2014 0:00;2014;10;16;3;25;35;0.14;24;18;12;0.6;42;-;-;2
17/10/2014 0:00;2014;10;17;4;22;30;0.22;23;24;15;0.6;42;-;-;2
18/10/2014 0:00;2014;10;18;5;20;32;0.26;44;25;16;0.3;42;-;-;2
19/10/2014 0:00;2014;10;19;8;3;16;0.11;26;31;23;0.5;42;-;-;2
20/10/2014 0:00;2014;10;20;7;21;31;0.79;52;15;24;0.5;42;-;-;2
21/10/2014 0:00;2014;10;21;7;18;30;0.75;52;24;18;0.3;43;2014 10 21;2014 10 27;3
22/10/2014 0:00;2014;10;22;4;6;27;0.13;37;40;24;1;43;-;-;3
23/10/2014 0:00;2014;10;23;25;30;51;1.43;72;8;25;0.9;43;-;-;3
24/10/2014 0:00;2014;10;24;16;24;50;1.48;77;13;31;1.3;43;-;-;3
25/10/2014 0:00;2014;10;25;14;20;42;1.09;78;7;28;0.7;43;-;-;3
26/10/2014 0:00;2014;10;26;7;12;28;0.32;62;17;26;0.7;43;-;-;3
27/10/2014 0:00;2014;10;27;12;32;41;2.11;77;6;26;0.9;43;-;-;3
28/10/2014 0:00;2014;10;28;15;34;46;1.78;73;8;32;1.3;44;2014 10 28;2014 11 3;4
29/10/2014 0:00;2014;10;29;10;51;51;0.97;91;4;30;1.2;44;-;-;4
30/10/2014 0:00;2014;10;30;17;51;44;0.7;71;8;30;0.8;44;-;-;4
31/10/2014 0:00;2014;10;31;17;36;56;1.54;79;11;17;0.3;44;-;-;4
01/11/2014 0:00;2014;11;1;7;4;24;0.19;29;40;21;0.4;44;-;-;4
02/11/2014 0:00;2014;11;2;7;7;28;0.57;33;20;16;0.5;44;-;-;4
03/11/2014 0:00;2014;11;3;11;31;41;0.62;37;17;12;0.2;44;-;-;4
04/11/2014 0:00;2014;11;4;4;5;24;0.34;23;43;13;0.3;45;2014 11 4;2014 11 10;1
05/11/2014 0:00;2014;11;5;5;6;26;0.29;20;41;18;0.9;45;-;-;1
06/11/2014 0:00;2014;11;6;11;25;41;0.32;34;12;15;0.6;45;-;-;1
07/11/2014 0:00;2014;11;7;12;10;35;0.38;38;35;15;0.7;45;-;-;1
08/11/2014 0:00;2014;11;8;7;7;35;0.59;27;27;13;0.3;45;-;-;1
09/11/2014 0:00;2014;11;9;11;3;22;0.45;28;46;14;0.8;45;-;-;1
10/11/2014 0:00;2014;11;10;14;22;41;0.57;30;21;11;0.3;45;-;-;1
11/11/2014 0:00;2014;11;11;15;7;27;0.62;29;40;16;0.5;46;2014 11 11;2014 11 17;2
12/11/2014 0:00;2014;11;12;9;25;41;0.46;38;26;17;0.7;46;-;-;2
13/11/2014 0:00;2014;11;13;6;22;34;0.33;36;28;21;1;46;-;-;2
14/11/2014 0:00;2014;11;14;7;30;46;0.43;54;21;13;0.3;46;-;-;2
15/11/2014 0:00;2014;11;15;6;4;20;0.35;21;48;13;0.2;46;-;-;2
16/11/2014 0:00;2014;11;16;12;4;22;0.84;33;49;15;0.6;46;-;-;2
17/11/2014 0:00;2014;11;17;6;12;37;0.44;36;32;21;1.1;46;-;-;2
18/11/2014 0:00;2014;11;18;9;39;44;0.36;40;7;18;0.9;47;2014 11 18;2014 11 24;3
19/11/2014 0:00;2014;11;19;6;31;43;0.18;39;20;30;1.6;47;-;-;3
20/11/2014 0:00;2014;11;20;7;69;41;0.48;58;5;28;1.6;47;-;-;3
21/11/2014 0:00;2014;11;21;12;62;46;0.5;51;4;26;0.9;47;-;-;3
22/11/2014 0:00;2014;11;22;6;19;31;0.26;36;10;16;0.2;47;-;-;3
23/11/2014 0:00;2014;11;23;4;3;20;0.11;17;43;14;0.2;47;-;-;3
24/11/2014 0:00;2014;11;24;4;5;26;0.11;11;43;14;0.2;47;-;-;3
25/11/2014 0:00;2014;11;25;5;10;31;0.16;16;28;20;0.5;48;2014 11 25;2014 11 31;4
26/11/2014 0:00;2014;11;26;6;15;38;0.17;27;21;21;1;48;-;-;4
27/11/2014 0:00;2014;11;27;16;44;42;0.82;35;14;16;0.9;48;-;-;4
28/11/2014 0:00;2014;11;28;9;28;53;0.36;27;23;18;1.1;48;-;-;4
29/11/2014 0:00;2014;11;29;5;6;29;0.15;20;19;19;0.7;48;-;-;4
30/11/2014 0:00;2014;11;30;7;4;19;0.15;43;36;17;0.4;48;-;-;4
31/11/2014 0:00;2014;11;31;7.5;7;23.5;0.16;35.5;35;16;0.3;48;-;-;4
01/12/2014 0:00;2014;12;1;8;10;28;0.17;28;34;15;0.2;49;2014 12 1;2014 12 7;1
02/12/2014 0:00;2014;12;2;7;7;28;0.17;19;35;13;0.3;49;-;-;1
03/12/2014 0:00;2014;12;3;8;11;29;0.16;16;27;12;0.5;49;-;-;1
04/12/2014 0:00;2014;12;4;6;10;34;0.23;14;23;13;0.4;49;-;-;1
05/12/2014 0:00;2014;12;5;6;12;36;0.21;18;31;11;0.2;49;-;-;1
06/12/2014 0:00;2014;12;6;7;4;25;0.16;17;43;12;0.2;49;-;-;1
07/12/2014 0:00;2014;12;7;8;2;18;0.17;14;43;11;0.1;49;-;-;1
08/12/2014 0:00;2014;12;8;7;3;20;0.2;17;45;14;0.3;50;2014 12 8;2014 12 14;2
09/12/2014 0:00;2014;12;9;6;15;40;0.2;25;26;12;0.2;50;-;-;2
10/12/2014 0:00;2014;12;10;10;12;36;0.14;18;26;14;0.2;50;-;-;2
11/12/2014 0:00;2014;12;11;5;10;37;0.17;32;33;22;0.6;50;-;-;2
12/12/2014 0:00;2014;12;12;11;37;42;0.46;44;10;9;0.2;50;-;-;2
13/12/2014 0:00;2014;12;13;8;3;19;0.11;9;55;11;0.3;50;-;-;2
14/12/2014 0:00;2014;12;14;6;3;20;0.13;14;49;18;0.4;50;-;-;2
15/12/2014 0:00;2014;12;15;6;18;38;0.33;25;15;11;0.2;51;2014 12 15;2014 12 21;3
16/12/2014 0:00;2014;12;16;4;11;36;0.17;17;34;12;0.3;51;-;-;3
17/12/2014 0:00;2014;12;17;5;8;29;0.16;17;40;16;0.4;51;-;-;3
18/12/2014 0:00;2014;12;18;10;24;41;0.21;23;15;20;0.5;51;-;-;3
19/12/2014 0:00;2014;12;19;15;27;43;0.54;29;9;18;0.4;51;-;-;3
20/12/2014 0:00;2014;12;20;16;23;41;0.28;23;11;9;0.2;51;-;-;3
21/12/2014 0:00;2014;12;21;7;5;23;0.14;17;45;17;0.4;51;-;-;3
22/12/2014 0:00;2014;12;22;7;16;33;0.23;21;27;29;0.9;52;2014 12 22;2014 12 28;4
23/12/2014 0:00;2014;12;23;25;65;45;1.24;55;15;22;0.5;52;-;-;4
24/12/2014 0:00;2014;12;24;17;22;48;0.54;33;16;21;0.3;52;-;-;4
25/12/2014 0:00;2014;12;25;8;4;27;0.16;20;32;20;0.3;52;-;-;4
26/12/2014 0:00;2014;12;26;8;16;35;0.31;27;23;14;0.1;52;-;-;4
27/12/2014 0:00;2014;12;27;11;4;20;0.38;38;43;9;0.1;52;-;-;4
28/12/2014 0:00;2014;12;28;5;2;13;0.11;14;67;17;0.3;52;-;-;4
29/12/2014 0:00;2014;12;29;5;20;35;0.24;23;34;23;0.4;53;2014 12 29;2015 1 4;1
30/12/2014 0:00;2014;12;30;7;27;41;0.25;30;26;26;0.6;53;-;-;1
31/12/2014 0:00;2014;12;31;27;44;51;0.85;41;21;29;0.6;53;-;-;1
01/01/2015 0:00;2015;1;1;35;25;41;0.82;32;23;31;0.7;53;-;-;1
02/01/2015 0:00;2015;1;2;44;63;51;0.64;45;19;26;0.4;53;-;-;1
03/01/2015 0:00;2015;1;3;25;30;40;0.68;33;25;25;0.3;53;-;-;1
04/01/2015 0:00;2015;1;4;20;16;34;0.95;29;25;24;0.3;53;-;-;1
05/01/2015 0:00;2015;1;5;19;40;35;0.38;28;12;30;0.2;54;2015 1 5;2015 1 11;2
06/01/2015 0:00;2015;1;6;17;16;36;0.58;36;9;28;0.4;54;-;-;2
07/01/2015 0:00;2015;1;7;29;40;48;1.4;45;6;28;0.8;54;-;-;2
08/01/2015 0:00;2015;1;8;33;52;52;0.86;48;6;26;0.8;54;-;-;2
09/01/2015 0:00;2015;1;9;35;46;45;0.74;57;6;26;0.4;54;-;-;2
10/01/2015 0:00;2015;1;10;13;16;35;0.24;32;11;17;0.2;54;-;-;2
11/01/2015 0:00;2015;1;11;7;8;30;0.23;25;30;22;0.5;54;-;-;2
12/01/2015 0:00;2015;1;12;30;51;46;1.17;44;6;24;0.5;55;2015 1 12;2015 1 18;3
13/01/2015 0:00;2015;1;13;17;50;49;0.46;58;12;19;0.5;55;-;-;3
14/01/2015 0:00;2015;1;14;9;35;46;0.54;39;15;13;0.2;55;-;-;3
15/01/2015 0:00;2015;1;15;12;14;35;0.29;26;35;9;0.2;55;-;-;3
16/01/2015 0:00;2015;1;16;10;9;33;0.56;17;39;14;0.4;55;-;-;3
17/01/2015 0:00;2015;1;17;10;14;29;0.43;23;36;11;0.2;55;-;-;3
18/01/2015 0:00;2015;1;18;10;5;23;0.46;18;38;10;0.1;55;-;-;3
19/01/2015 0:00;2015;1;19;7;9;34;0.27;13;37;8;0.1;56;2015 1 19;2015 1 25;4
20/01/2015 0:00;2015;1;20;9;8;34;0.33;11;37;4;0.1;56;-;-;4
21/01/2015 0:00;2015;1;21;13;10;34;0.46;14;45;7;0.2;56;-;-;4
22/01/2015 0:00;2015;1;22;8;9;34;0.26;14;39;14;0.5;56;-;-;4
23/01/2015 0:00;2015;1;23;9;27;47;0.54;23;16;12;0.5;56;-;-;4
24/01/2015 0:00;2015;1;24;14;10;41;0.63;20;21;12;0.6;56;-;-;4
25/01/2015 0:00;2015;1;25;8;13;47;0.45;20;20;32;0.6;56;-;-;4
26/01/2015 0:00;2015;1;26;8;13;47;0.45;20;20;13;0.3;57;2015 1 26;2015 2 1;1
27/01/2015 0:00;2015;1;27;3;17;53;0.27;20;19;10;0.3;57;-;-;1
28/01/2015 0:00;2015;1;28;11;10;40;0.49;18;30;3;0.1;57;-;-;1
29/01/2015 0:00;2015;1;29;23;10;31;0.68;22;40;6;0.1;57;-;-;1
30/01/2015 0:00;2015;1;30;8;6;19;0.16;11;57;3;0.1;57;-;-;1
31/01/2015 0:00;2015;1;31;10;5;20;0.23;18;69;4;0.1;57;-;-;1
01/02/2015 0:00;2015;2;1;10;3;18;0.44;11;67;5;0.1;57;-;-;1
02/02/2015 0:00;2015;2;2;14;14;35;0.9;14;43;4;0.1;58;2015 2 2;2015 2 8;2
03/02/2015 0:00;2015;2;3;9;6;26;0.22;8;67;4;0.1;58;-;-;2
04/02/2015 0:00;2015;2;4;5;5;17;0.2;13;78;5;0.1;58;-;-;2
05/02/2015 0:00;2015;2;5;5;10;34;0.19;13;55;8;0.2;58;-;-;2
06/02/2015 0:00;2015;2;6;6;15;42;0.3;14;35;24;0.3;58;-;-;2
07/02/2015 0:00;2015;2;7;3;10;38;0.38;26;18;18;0.1;58;-;-;2
08/02/2015 0:00;2015;2;8;7;6;33;0.23;28;35;8;0.1;58;-;-;2
09/02/2015 0:00;2015;2;9;6;5;26;0.16;24;64;21;0.1;59;2015 2 9;2015 2 15;3
10/02/2015 0:00;2015;2;10;7;28;50;0.5;38;27;20;0.2;59;-;-;3
11/02/2015 0:00;2015;2;11;17;36;67;0.33;39;15;29;0.2;59;-;-;3
12/02/2015 0:00;2015;2;12;28;50;73;1.92;55;9;12;0.1;59;-;-;3
13/02/2015 0:00;2015;2;13;15;19;48;0.69;26;28;8;0.2;59;-;-;3
14/02/2015 0:00;2015;2;14;17;11;36;1.06;31;21;8;0.1;59;-;-;3
15/02/2015 0:00;2015;2;15;7;5;24;0.34;17;19;4;0.1;59;-;-;3
16/02/2015 0:00;2015;2;16;7;8;31;0.15;13;37;4;0.1;60;2015 2 16;2015 2 22;4
17/02/2015 0:00;2015;2;17;5;2;14;0.13;14;65;9;0.15;60;-;-;4
18/02/2015 0:00;2015;2;18;8;13;35;0.27;23;34;17;0.2;60;-;-;4
19/02/2015 0:00;2015;2;19;15;23;54;0.68;34;15;11;0.25;60;-;-;4
20/02/2015 0:00;2015;2;20;6;10;44;0.51;18;27;4;0.3;60;-;-;4
21/02/2015 0:00;2015;2;21;7;6;23;0.31;14;54;3;0.3;60;-;-;4
22/02/2015 0:00;2015;2;22;8;3;18;0.65;21;45;5;0.2;60;-;-;4
23/02/2015 0:00;2015;2;23;11;6;25;0.69;19;47;7;0.4;61;2015 2 23;2015 2 29;1
24/02/2015 0:00;2015;2;24;19;7;31;0.71;24;45;7;0.6;61;-;-;1
25/02/2015 0:00;2015;2;25;15;7;27;0.42;18;45;7;0.5;61;-;-;1
26/02/2015 0:00;2015;2;26;15;10;29;0.2;15;38;6;0.5;61;-;-;1
27/02/2015 0:00;2015;2;27;8;9;36;0.22;17;48;4;0.5;61;-;-;1
28/02/2015 0:00;2015;2;28;5;5;25;0.42;10;30;7;0.4;61;-;-;1
29/05/2015 0:00;2015;2;29;5.5;5.25;24.25;0.4175;11.75;31.25;7;0.45;61;-;-;1
30/02/2015 0:00;2015;2;30;6;5.5;23.5;0.415;13.5;32.5;7;0.5;62;2015 2 30;2015 3 5;2
31/02/2015 0:00;2015;2;31;6.5;5.75;22.75;0.4125;15.25;33.75;7;0.55;62;-;-;2
01/03/2015 0:00;2015;3;1;7;6;22;0.41;17;35;7;0.6;62;-;-;2
02/03/2015 0:00;2015;3;2;7;9;35;0.18;14;36;6;0.6;62;-;-;2
03/03/2015 0:00;2015;3;3;4;6;33;0.14;9;44;7;0.5;62;-;-;2
04/03/2015 0:00;2015;3;4;3;7;33;0.21;14;46;9;0.5;62;-;-;2
05/03/2015 0:00;2015;3;5;6;11;29;0.24;20;47;15;1;62;-;-;2
06/03/2015 0:00;2015;3;6;8;21;40;0.42;35;32;21;1.4;63;2015 3 6;2015 3 12;3
07/03/2015 0:00;2015;3;7;16;13;42;0.95;42;26;17;0.8;63;-;-;3
08/03/2015 0:00;2015;3;8;17;6;32;0.43;27;44;21;0.7;63;-;-;3
09/03/2015 0:00;2015;3;9;3;16;35;0.29;30;41;30;0.6;63;-;-;3
10/03/2015 0:00;2015;3;10;4;4;32;0.41;45;46;27;0.8;63;-;-;3
11/03/2015 0:00;2015;3;11;9;6;35;0.27;42;41;28;1;63;-;-;3
12/03/2015 0:00;2015;3;12;8;17;37;0.27;53;24;4;0.4;63;-;-;3
13/03/2015 0:00;2015;3;13;5;7;27;0.28;16;55;7;0.6;64;2015 3 13;2015 3 19;4
14/03/2015 0:00;2015;3;14;3;4;23;0.2;14;49;18;0.6;64;-;-;4
15/03/2015 0:00;2015;3;15;4;3;24;0.19;26;43;20;0.7;64;-;-;4
16/03/2015 0:00;2015;3;16;4;12;36;0.27;28;35;19;0.7;64;-;-;4
17/03/2015 0:00;2015;3;17;5;13;36;0.39;29;37;17;0.7;64;-;-;4
18/03/2015 0:00;2015;3;18;4;8;31;0.18;35;46;14;0.5;64;-;-;4
19/03/2015 0:00;2015;3;19;3;8;30;0.21;27;45;27;0.5;64;-;-;4
20/03/2015 0:00;2015;3;20;3;4;23;0.21;40;61;15;0.6;65;2015 3 20;2015 3 26;1
21/03/2015 0:00;2015;3;21;5;4;27;0.27;22;46;12;0.3;65;-;-;1
22/03/2015 0:00;2015;3;22;6;2;14;0.13;25;60;5;0.4;65;-;-;1
23/03/2015 0:00;2015;3;23;3;8;29;0.26;9;43;9;0.4;65;-;-;1
24/03/2015 0:00;2015;3;24;2;6;27;0.16;19;52;4;0.4;65;-;-;1
25/03/2015 0:00;2015;3;25;4;7;29;0.24;11;45;6;0.4;65;-;-;1
26/03/2015 0:00;2015;3;26;4;7;28;0.16;5;36;8;0.5;65;-;-;1
27/03/2015 0:00;2015;3;27;5;8;22;0.15;11;39;12;0.6;66;2015 3 27;2015 4 2;2
28/03/2015 0:00;2015;3;28;7;6;26;0.28;23;32;11;0.7;66;-;-;2
29/03/2015 0:00;2015;3;29;11;5;26;0.28;21;37;7;0.4;66;-;-;2
30/03/2015 0:00;2015;3;30;11;5;25;0.86;25;50;6;0.3;66;-;-;2
31/03/2015 0:00;2015;3;31;14;7;25;0.44;25;41;5;0.2;66;-;-;2
01/04/2015 0:00;2015;4;1;6;3;16;0.13;28;59;6;0.3;66;-;-;2
02/04/2015 0:00;2015;4;2;6;4;19;0.29;29;44;8;0.3;66;-;-;2
03/04/2015 0:00;2015;4;3;4;5;22;0.35;29;40;3;0.2;67;2015 4 3;2015 4 9;3
04/04/2015 0:00;2015;4;4;3;2;13;0.14;17;67;4;0.2;67;-;-;3
05/04/2015 0:00;2015;4;5;3;2;9;0.17;18;62;5;0.3;67;-;-;3
06/04/2015 0:00;2015;4;6;5;4;16;0.17;27;67;11;0.5;67;-;-;3
07/04/2015 0:00;2015;4;7;9;10;24;0.24;38;53;14;0.8;67;-;-;3
08/04/2015 0:00;2015;4;8;12;16;41;0.37;43;45;13;0.6;67;-;-;3
09/04/2015 0:00;2015;4;9;17;8;35;0.31;40;52;13;0.5;67;-;-;3
10/04/2015 0:00;2015;4;10;8;9;33;0.17;25;40;10;0.5;68;2015 4 10;2015 4 16;4
11/04/2015 0:00;2015;4;11;5;4;21;0.3;26;43;13;0.5;68;-;-;4
12/04/2015 0:00;2015;4;12;5;4;19;0.17;36;42;16;0.7;68;-;-;4
13/04/2015 0:00;2015;4;13;10;17;34;0.7;59;36;22;1;68;-;-;4
14/04/2015 0:00;2015;4;14;14;18;53;0.85;77;32;16;0.6;68;-;-;4
15/04/2015 0:00;2015;4;15;11;9;44;0.41;64;31;8;0.4;68;-;-;4
16/04/2015 0:00;2015;4;16;5;12;31;0.37;33;37;5;0.2;68;-;-;4
17/04/2015 0:00;2015;4;17;7;4;25;0.11;18;53;4;0.3;69;2015 4 17;2015 4 23;1
18/04/2015 0:00;2015;4;18;9;4;22;0.24;16;47;5;0.3;69;-;-;1
19/04/2015 0:00;2015;4;19;5;3;19;0.3;16;50;10;0.5;69;-;-;1
20/04/2015 0:00;2015;4;20;9;8;21;0.56;28;49;11;0.4;69;-;-;1
21/04/2015 0:00;2015;4;21;4;5;21;0.17;27;55;14;0.8;69;-;-;1
22/04/2015 0:00;2015;4;22;5;19;37;0.4;36;32;5;0.3;69;-;-;1
23/04/2015 0:00;2015;4;23;6;5;18;0.36;19;44;12;0.8;69;-;-;1
24/04/2015 0:00;2015;4;24;10;10;33;0.37;32;34;9;0.4;70;2015 4 24;2015 4 30;2
25/04/2015 0:00;2015;4;25;7;6;22;0.37;23;39;5;0.3;70;-;-;2
26/04/2015 0:00;2015;4;26;3;3;17;0.23;14;47;3;0.4;70;-;-;2
27/04/2015 0:00;2015;4;27;3;7;26;0.22;16;40;3;0.3;70;-;-;2
28/04/2015 0:00;2015;4;28;3;7;18;0.19;15;49;7;0.3;70;-;-;2
29/04/2015 0:00;2015;4;29;5;8;26;0.21;22;40;11;0.5;70;-;-;2
30/04/2015 0:00;2015;4;30;7;16;38;0.91;34;20;4;0.3;70;-;-;2
31/04/2015 0:00;2015;4;31;6;10.5;28;0.6;25;23.5;6.5;0.45;71;2015 4 31;2015 5 6;3
01/05/2015 0:00;2015;5;1;5;5;18;0.29;16;27;9;0.6;71;-;-;3
02/05/2015 0:00;2015;5;2;4;14;25;0.35;16;16;3;0.3;71;-;-;3
03/05/2015 0:00;2015;5;3;3;5;17;0.13;8;34;5;0.5;71;-;-;3
04/05/2015 0:00;2015;5;4;5;16;32;0.31;18;35;5;0.3;71;-;-;3
05/05/2015 0:00;2015;5;5;5;5;23;0.21;14;57;6;0.3;71;-;-;3
06/05/2015 0:00;2015;5;6;6;7;22;0.32;20;52;8;0.3;71;-;-;3
07/05/2015 0:00;2015;5;7;7;6;22;0.21;28;50;6;0.4;72;2015 5 7;2015 5 13;4
08/05/2015 0:00;2015;5;8;7;8;24;0.27;20;48;2;0.1;72;-;-;4
09/05/2015 0:00;2015;5;9;4;2;11;0.11;11;56;14;0.3;72;-;-;4
10/05/2015 0:00;2015;5;10;5;4;17;0.22;25;39;22;0.6;72;-;-;4
11/05/2015 0:00;2015;5;11;9;8;29;0.44;40;44;13;0.2;72;-;-;4
12/05/2015 0:00;2015;5;12;5;6;20;0.18;25;46;13;0.3;72;-;-;4
13/05/2015 0:00;2015;5;13;4;3;22;0.19;30;51;7;0.3;72;-;-;4
14/05/2015 0:00;2015;5;14;11;6;22;0.38;32;47;6;0.2;73;2015 5 14;2015 5 20;1
15/05/2015 0:00;2015;5;15;11;6;23;0.8;24;46;5;0.3;73;-;-;1
16/05/2015 0:00;2015;5;16;6;4;17;0.17;15;46;4;0.1;73;-;-;1
17/05/2015 0:00;2015;5;17;5;2;9;0.1;10;48;4;0.2;73;-;-;1
18/05/2015 0:00;2015;5;18;9;4;16;0.18;13;51;5;0.3;73;-;-;1
19/05/2015 0:00;2015;5;19;4;5;21;0.15;19;54;5;0.3;73;-;-;1
20/05/2015 0:00;2015;5;20;5;6;26;0.19;15;46;6;0.2;73;-;-;1
21/05/2015 0:00;2015;5;21;5;5;19;0.16;15;50;7;0.2;74;2015 5 21;2015 5 27;2
22/05/2015 0:00;2015;5;22;5;5;20;0.18;17;50;5;0.2;74;-;-;2
23/05/2015 0:00;2015;5;23;5;3;15;0.22;14;47;4;0.1;74;-;-;2
24/05/2015 0:00;2015;5;24;5;3;13;0.19;9;38;4;0.1;74;-;-;2
25/05/2015 0:00;2015;5;25;6;4;14;0.11;12;43;6;0.2;74;-;-;2
26/05/2015 0:00;2015;5;26;3;4;16;0.12;15;47;5;0.1;74;-;-;2
27/05/2015 0:00;2015;5;27;5;3;12;0.12;15;60;8;0.2;74;-;-;2
28/05/2015 0:00;2015;5;28;4;6;13;0.12;13;60;6;0.2;75;2015 5 28;2015 6 3;3
29/05/2015 0:00;2015;5;29;3;3;14;0.13;12;60;8;0.2;75;-;-;3
30/05/2015 0:00;2015;5;30;2;3;15;0.2;19;38;8;0.3;75;-;-;3
31/05/2015 0:00;2015;5;31;5;6;17;0.21;16;24;3;0.2;75;-;-;3
01/06/2015 0:00;2015;6;1;8;5;17;0.12;8;45;8;0.3;75;-;-;3
02/06/2015 0:00;2015;6;2;6;7;20;0.17;30;43;6;0.2;75;-;-;3
03/06/2015 0:00;2015;6;3;5;6;20;0.1;29;32;10;0.3;75;-;-;3
04/06/2015 0:00;2015;6;4;3;6;20;0.15;29;33;5;0.2;76;2015 6 4;2015 6 10;4
05/06/2015 0:00;2015;6;5;4;5;17;0.12;18;42;3;0.1;76;-;-;4
06/06/2015 0:00;2015;6;6;6;2;10;0.12;13;47;4;0.1;76;-;-;4
07/06/2015 0:00;2015;6;7;4;2;7;0.13;22;58;6;0.2;76;-;-;4
08/06/2015 0:00;2015;6;8;5;2;12;0.13;34;71;7;0.2;76;-;-;4
09/06/2015 0:00;2015;6;9;5;3;18;0.15;34;70;9;0.2;76;-;-;4
10/06/2015 0:00;2015;6;10;5;5;30;0.15;37;45;13;0.3;76;-;-;4
11/06/2015 0:00;2015;6;11;4;5;26;0.2;38;53;7;0.2;77;2015 6 11;2015 6 17;1
12/06/2015 0:00;2015;6;12;3;4;20;0.13;17;67;6;0.2;77;-;-;1
13/06/2015 0:00;2015;6;13;5;3;22;0.34;24;49;5;0.2;77;-;-;1
14/06/2015 0:00;2015;6;14;3;3;14;0.18;17;47;7;0.2;77;-;-;1
15/06/2015 0:00;2015;6;15;3;5;21;0.13;16;56;8;0.3;77;-;-;1
16/06/2015 0:00;2015;6;16;3;6;20;0.17;17;44;8;0.3;77;-;-;1
17/06/2015 0:00;2015;6;17;3;5;19;0.16;19;55;8;0.2;77;-;-;1
18/06/2015 0:00;2015;6;18;3;3;17;0.15;16;58;6;0.2;78;2015 6 18;2015 6 24;2
19/06/2015 0:00;2015;6;19;4;5;17;0.2;13;38;7;0.1;78;-;-;2
20/06/2015 0:00;2015;6;20;2;3;11;0.13;13;51;11;0.1;78;-;-;2
21/06/2015 0:00;2015;6;21;4;2;12;0.16;15;50;9;0.2;78;-;-;2
22/06/2015 0:00;2015;6;22;4;5;14;0.19;11;41;10;0.2;78;-;-;2
23/06/2015 0:00;2015;6;23;2;4;14;0.23;7;41;18;0.4;78;-;-;2
24/06/2015 0:00;2015;6;24;2;9;15;0.31;23;37;18;0.4;78;-;-;2
25/06/2015 0:00;2015;6;25;3;8;20;0.33;39;41;23;0.3;79;2015 6 25;2015 6 31;3
26/06/2015 0:00;2015;6;26;9;7;24;0.19;45;46;15;0.3;79;-;-;3
27/06/2015 0:00;2015;6;27;5;3;15;0.26;27;34;14;0.5;79;-;-;3
28/06/2015 0:00;2015;6;28;4;3;15;0.11;30;27;10;0.2;79;-;-;3
29/06/2015 0:00;2015;6;29;3;3;10;0.1;20;36;20;0.6;79;-;-;3
30/06/2015 0:00;2015;6;30;5;13;27;0.35;52;28;15;0.3;79;-;-;3
31/06/2015 0:00;2015;6;31;5.5;8.5;22;0.255;36;34;11.5;0.3;79;-;-;3
01/07/2015 0:00;2015;7;1;6;4;17;0.16;20;40;8;0.3;80;2015 7 1;2015 7 7;4
02/07/2015 0:00;2015;7;2;3;4;15;0.14;15;44;13;0.3;80;-;-;4
03/07/2015 0:00;2015;7;3;8;7;21;0.15;20;42;16;0.3;80;-;-;4
04/07/2015 0:00;2015;7;4;3;3;19;0.33;35;41;8;0.3;80;-;-;4
05/07/2015 0:00;2015;7;5;4;2;11;0.11;13;44;11;0.4;80;-;-;4
06/07/2015 0:00;2015;7;6;3;6;19;0.13;23;38;13;0.8;80;-;-;4
07/07/2015 0:00;2015;7;7;4;7;20;0.3;34;26;7;0.2;80;-;-;4
08/07/2015 0:00;2015;7;8;3;5;19;0.2;16;37;8;0.1;81;2015 7 8;2015 7 14;1
09/07/2015 0:00;2015;7;9;4;3;10;0.1;17;49;14;0.3;81;-;-;1
10/07/2015 0:00;2015;7;10;7;10;23;0.27;34;41;9;0.2;81;-;-;1
11/07/2015 0:00;2015;7;11;6;3;12;0.1;16;44;8;0.1;81;-;-;1
12/07/2015 0:00;2015;7;12;3;3;7;0.12;8;46;10;0.2;81;-;-;1
13/07/2015 0:00;2015;7;13;2;9;15;0.36;29;33;7;0.2;81;-;-;1
14/07/2015 0:00;2015;7;14;4;4;12;0.11;14;37;9;0.1;81;-;-;1
15/07/2015 0:00;2015;7;15;4;4;10;0.1;11;36;14;0.3;82;2015 7 15;2015 7 21;2
16/07/2015 0:00;2015;7;16;2;8;19;0.18;24;38;19;0.5;82;-;-;2
17/07/2015 0:00;2015;7;17;5;9;22;0.21;36;41;16;0.2;82;-;-;2
18/07/2015 0:00;2015;7;18;6;4;17;0.11;23;42;12;0.2;82;-;-;2
19/07/2015 0:00;2015;7;19;4;3;14;0.1;18;38;12;0.3;82;-;-;2
20/07/2015 0:00;2015;7;20;3;8;21;0.26;26;34;9;0.2;82;-;-;2
21/07/2015 0:00;2015;7;21;2;5;17;0.1;20;35;8;0.2;82;-;-;2
22/07/2015 0:00;2015;7;22;2;6;20;0.12;20;27;8;0.3;83;2015 7 22;2015 7 28;3
23/07/2015 0:00;2015;7;23;2;9;18;0.16;18;33;11;0.4;83;-;-;3
24/07/2015 0:00;2015;7;24;2;10;26;0.48;33;23;8;0.2;83;-;-;3
25/07/2015 0:00;2015;7;25;3;2;14;0.18;28;46;11;0.3;83;-;-;3
26/07/2015 0:00;2015;7;26;5;5;18;1.31;29;26;8;0.2;83;-;-;3
27/07/2015 0:00;2015;7;27;8;7;19;0.17;32;29;10;0.3;83;-;-;3
28/07/2015 0:00;2015;7;28;6;6;20;0.12;29;29;6;0.2;83;-;-;3
29/07/2015 0:00;2015;7;29;5;3;13;0.12;15;43;6;0.1;84;2015 7 29;2015 8 4;4
30/07/2015 0:00;2015;7;30;3;3;14;0.1;18;53;9;0.3;84;-;-;4
31/07/2015 0:00;2015;7;31;3;5;26;0.12;23;46;9;0.2;84;-;-;4
01/08/2015 0:00;2015;8;1;3;4;19;0.12;23;46;12;0.2;84;-;-;4
02/08/2015 0:00;2015;8;2;3;4;19;0.12;23;46;14;0.3;84;-;-;4
03/08/2015 0:00;2015;8;3;3;6;21;0.14;28;39;6;0.2;84;-;-;4
04/08/2015 0:00;2015;8;4;4;4;19;0.19;25;40;10;0.4;84;-;-;4
05/08/2015 0:00;2015;8;5;4;7;20;0.43;31;43;9;0.2;85;2015 8 5;2015 8 11;1
06/08/2015 0:00;2015;8;6;5;4;15;0.1;25;49;10;0.2;85;-;-;1
07/08/2015 0:00;2015;8;7;6;7;22;0.17;24;40;7;0.2;85;-;-;1
08/08/2015 0:00;2015;8;8;4;4;16;0.11;21;42;7;0.2;85;-;-;1
09/08/2015 0:00;2015;8;9;3;3;13;0.17;21;45;15;0.4;85;-;-;1
10/08/2015 0:00;2015;8;10;4;10;20;0.31;31;42;14;0.3;85;-;-;1
11/08/2015 0:00;2015;8;11;4;4;23;0.11;36;39;17;0.3;85;-;-;1
12/08/2015 0:00;2015;8;12;4;8;25;0.14;41;34;14;0.5;86;2015 8 12;2015 8 18;2
13/08/2015 0:00;2015;8;13;5;7;21;0.21;30;31;10;0.3;86;-;-;2
14/08/2015 0:00;2015;8;14;6;7;21;0.47;26;35;10;0.3;86;-;-;2
15/08/2015 0:00;2015;8;15;4;3;13;0.14;19;34;12;0.1;86;-;-;2
16/08/2015 0:00;2015;8;16;5;3;15;0.19;18;30;10;0.1;86;-;-;2
17/08/2015 0:00;2015;8;17;4;7;18;0.21;20;33;8;0.12;86;-;-;2
18/08/2015 0:00;2015;8;18;5;9;20;0.18;22;34;8;0.14;86;-;-;2
19/08/2015 0:00;2015;8;19;4;5;15;0.13;17;41;13;0.16;87;2015 8 19;2015 8 25;3
20/08/2015 0:00;2015;8;20;4;9;22;0.14;31;34;23;0.18;87;-;-;3
21/08/2015 0:00;2015;8;21;5;6;28;0.22;43;36;13;0.2;87;-;-;3
22/08/2015 0:00;2015;8;22;4;3;17;0.11;25;46;6;0.2;87;-;-;3
23/08/2015 0:00;2015;8;23;4;3;15;0.59;33;37;7;0.2;87;-;-;3
24/08/2015 0:00;2015;8;24;9;6;21;0.72;24;37;6;0.2;87;-;-;3
25/08/2015 0:00;2015;8;25;5;7;22;0.27;21;33;9;0.2;87;-;-;3
26/08/2015 0:00;2015;8;26;6;11;24;0.2;23;25;10;0.2;88;2015 8 26;2015 9 1;4
27/08/2015 0:00;2015;8;27;5;6;19;0.16;19;33;9;0.2;88;-;-;4
28/08/2015 0:00;2015;8;28;3;3;13;0.1;11;40;20;0.3;88;-;-;4
29/08/2015 0:00;2015;8;29;3;6;21;0.27;41;31;21;0.2;88;-;-;4
30/08/2015 0:00;2015;8;30;4;3;17;0.16;38;35;14;0.3;88;-;-;4
31/08/2015 0:00;2015;8;31;3;6;22;0.14;28;41;9;0.1;88;-;-;4
01/09/2015 0:00;2015;9;1;3;3;15;0.13;21;58;8;0.2;88;-;-;4
02/09/2015 0:00;2015;9;2;3;4;20;0.17;15;52;11;0.2;89;2015 9 2;2015 9 8;1
03/09/2015 0:00;2015;9;3;3;5;22;0.25;15;49;10;0.2;89;-;-;1
04/09/2015 0:00;2015;9;4;3;5;21;0.17;14;41;7;0.2;89;-;-;1
05/09/2015 0:00;2015;9;5;4;3;14;0.19;18;51;8;0.2;89;-;-;1
06/09/2015 0:00;2015;9;6;4;3;12;0.2;18;52;12;0.2;89;-;-;1
07/09/2015 0:00;2015;9;7;3;8;17;0.2;30;58;10;0.2;89;-;-;1
08/09/2015 0:00;2015;9;8;3;4;17;0.32;28;48;15;0.4;89;-;-;1
09/09/2015 0:00;2015;9;9;5;11;30;0.34;43;40;12;0.4;90;2015 9 9;2015 9 15;2
10/09/2015 0:00;2015;9;10;7;11;28;0.25;35;39;15;0.3;90;-;-;2
11/09/2015 0:00;2015;9;11;4;14;24;0.19;37;43;11;0.3;90;-;-;2
12/09/2015 0:00;2015;9;12;5;6;24;0.43;35;33;9;0.3;90;-;-;2
13/09/2015 0:00;2015;9;13;5;4;17;0.39;23;32;9;0.2;90;-;-;2
14/09/2015 0:00;2015;9;14;7;5;25;0.38;35;44;9;0.4;90;-;-;2
15/09/2015 0:00;2015;9;15;3;14;32;0.55;20;24;10;0.3;90;-;-;2
16/09/2015 0:00;2015;9;16;20;21;31;0.89;69;26;9;0.2;91;2015 9 16;2015 9 22;3
17/09/2015 0:00;2015;9;17;9;5;25;0.34;35;36;9;0.2;91;-;-;3
18/09/2015 0:00;2015;9;18;4;8;26;0.16;19;36;9;0.2;91;-;-;3
19/09/2015 0:00;2015;9;19;3;4;17;0.23;20;39;10;0.3;91;-;-;3
20/09/2015 0:00;2015;9;20;6;3;16;0.26;21;36;15;0.4;91;-;-;3
21/09/2015 0:00;2015;9;21;5;9;30;0.36;37;30;11;0.3;91;-;-;3
22/09/2015 0:00;2015;9;22;2;3;57;0.22;25;18;11;0.3;91;-;-;3
23/09/2015 0:00;2015;9;23;3;8;57;0.26;21;13;10;0.2;92;2015 9 23;2015 9 29;4
24/09/2015 0:00;2015;9;24;3;16;30;0.2;26;36;10;0.2;92;-;-;4
25/09/2015 0:00;2015;9;25;4;4;24;0.16;29;50;11;0.1;92;-;-;4
26/09/2015 0:00;2015;9;26;3;2;14;0.15;29;52;12;0.1;92;-;-;4
27/09/2015 0:00;2015;9;27;3;2;12;0.18;22;56;17;0.3;92;-;-;4
28/09/2015 0:00;2015;9;28;3;11;23;0.22;42;49;19;0.3;92;-;-;4
29/09/2015 0:00;2015;9;29;3;9;27;0.31;35;40;17;0.3;92;-;-;4
30/09/2015 0:00;2015;9;30;5;7;29;0.21;30;43;27;0.4;93;2015 9 30;2015 10 5;1
31/09/2015 0:00;2015;9;31;6.5;9.5;30;0.23;30.5;42;24;0.35;93;-;-;1
01/10/2015 0:00;2015;10;1;8;12;31;0.25;31;41;21;0.3;93;-;-;1
02/10/2015 0:00;2015;10;2;5;5;36;0.22;29;45;23;0.4;93;-;-;1
03/10/2015 0:00;2015;10;3;3;5;31;0.36;28;37;16;0.3;93;-;-;1
04/10/2015 0:00;2015;10;4;2;7;28;0.17;20;22;13;0.4;93;-;-;1
05/10/2015 0:00;2015;10;5;4;19;38;0.47;28;13;11;0.2;93;-;-;1
06/10/2015 0:00;2015;10;6;6;7;25;0.29;22;34;10;0.2;94;2015 10 6;2015 10 12;2
07/10/2015 0:00;2015;10;7;6;9;27;0.52;21;29;10;0.2;94;-;-;2
08/10/2015 0:00;2015;10;8;4;12;22;0.23;23;33;14;0.3;94;-;-;2
09/10/2015 0:00;2015;10;9;6;14;25;0.43;29;32;18;0.4;94;-;-;2
10/10/2015 0:00;2015;10;10;6;12;31;0.3;26;23;15;0.3;94;-;-;2
11/10/2015 0:00;2015;10;11;3;4;20;0.2;22;38;16;0.3;94;-;-;2
12/10/2015 0:00;2015;10;12;3;2;15;0.18;26;43;17;0.3;94;-;-;2
13/10/2015 0:00;2015;10;13;4;11;25;0.4;26;37;14;0.2;95;2015 10 13;2015 10 19;3
14/10/2015 0:00;2015;10;14;3;9;25;0.21;24;54;12;0.3;95;-;-;3
15/10/2015 0:00;2015;10;15;5;12;28;0.28;20;44;12;0.3;95;-;-;3
16/10/2015 0:00;2015;10;16;7;21;33;0.31;27;30;12;0.4;95;-;-;3
17/10/2015 0:00;2015;10;17;4;8;28;0.24;26;27;12;0.4;95;-;-;3
18/10/2015 0:00;2015;10;18;3;5;27;0.27;30;29;12;0.3;95;-;-;3
19/10/2015 0:00;2015;10;19;2;4;15;0.16;23;42;12;0.4;95;-;-;3
20/10/2015 0:00;2015;10;20;3;3;23;0.28;32;50;16;0.3;96;2015 10 20;2015 10 26;4
21/10/2015 0:00;2015;10;21;5;13;32;0.29;23;34;19;0.4;96;-;-;4
22/10/2015 0:00;2015;10;22;7;15;33;0.25;28;32;23;0.4;96;-;-;4
23/10/2015 0:00;2015;10;23;6;29;37;0.67;47;16;24;0.4;96;-;-;4
24/10/2015 0:00;2015;10;24;9;24;40;0.35;32;14;16;0.4;96;-;-;4
25/10/2015 0:00;2015;10;25;6;4;19;0.21;22;53;21;0.8;96;-;-;4
26/10/2015 0:00;2015;10;26;7;42;37;0.74;40;18;12;0.4;96;-;-;4
27/10/2015 0:00;2015;10;27;10;12;40;0.2;21;31;15;0.2;97;2015 10 27;2015 11 2;1
28/10/2015 0:00;2015;10;28;10;22;44;0.32;29;17;21;1;97;-;-;1
29/10/2015 0:00;2015;10;29;3;48;44;0.4;38;13;20;0.6;97;-;-;1
30/10/2015 0:00;2015;10;30;4;66;49;0.34;62;9;25;1.4;97;-;-;1
31/10/2015 0:00;2015;10;31;10;52;52;0.47;71;13;17;0.1;97;-;-;1
01/11/2015 0:00;2015;11;1;8;3;23;0.17;22;37;19;0.5;97;-;-;1
02/11/2015 0:00;2015;11;2;3;12;34;0.29;24;21;15;0.7;97;-;-;1
03/11/2015 0:00;2015;11;3;3;25;42;0.24;23;24;20;1.6;98;2015 11 3;2015 11 9;2
04/11/2015 0:00;2015;11;4;9;58;46;0.54;45;7;26;2.5;98;-;-;2
05/11/2015 0:00;2015;11;5;10;91;45;0.24;37;6;17;1.4;98;-;-;2
06/11/2015 0:00;2015;11;6;8;32;34;0.39;29;12;13;1;98;-;-;2
07/11/2015 0:00;2015;11;7;10;17;31;0.29;24;14;15;1.1;98;-;-;2
08/11/2015 0:00;2015;11;8;7;31;41;1.22;44;9;24;1;98;-;-;2
09/11/2015 0:00;2015;11;9;4;24;43;0.25;43;11;30;1.8;98;-;-;2
10/11/2015 0:00;2015;11;10;6;27;37;0.3;39;12;22;0.6;99;2015 11 10;2015 11 16;3
11/11/2015 0:00;2015;11;11;6;18;37;0.31;31;20;30;1.3;99;-;-;3
12/11/2015 0:00;2015;11;12;11;29;41;0.45;44;8;29;1.066666667;99;-;-;3
13/11/2015 0:00;2015;11;13;15;27;38;0.41;35;20;28;0.833333333;99;-;-;3
14/11/2015 0:00;2015;11;14;6;11;24;0.32;21;29;27;0.6;99;-;-;3
15/11/2015 0:00;2015;11;15;20;16;30;1.64;32;17;26;0.8;99;-;-;3
16/11/2015 0:00;2015;11;16;8;32;43;0.56;42;13;25;1.1;99;-;-;3
17/11/2015 0:00;2015;11;17;16;37;48;1.15;59;8;27;1.3;100;2015 11 17;2015 11 23;4
18/11/2015 0:00;2015;11;18;15;39;41;0.67;50;9;25;1;100;-;-;4
19/11/2015 0:00;2015;11;19;23;39;37;1.13;57;10;25;0.4;100;-;-;4
20/11/2015 0:00;2015;11;20;19;19;32;0.5;81;21;16.5;0.35;100;-;-;4
21/11/2015 0:00;2015;11;21;4;5;22;0.21;19;53;8;0.3;100;-;-;4
22/11/2015 0:00;2015;11;22;4;3;19;0.22;10;50;12;0.5;100;-;-;4
23/11/2015 0:00;2015;11;23;4;10;33;0.28;15;24;9;0.4;100;-;-;4
24/11/2015 0:00;2015;11;24;4;10;36;0.33;17;26;10;0.4;101;2015 11 24;2015 11 30;1
25/11/2015 0:00;2015;11;25;9;6;33;0.42;35;43;9;2.4;101;-;-;1
26/11/2015 0:00;2015;11;26;9;15;42;0.2;19;30;7;3.1;101;-;-;1
27/11/2015 0:00;2015;11;27;5;10;33;0.21;15;34;8;3;101;-;-;1
28/11/2015 0:00;2015;11;28;4;5;28;0.27;20;42;14;3.4;101;-;-;1
29/11/2015 0:00;2015;11;29;8;9;36;0.37;23;19;20;4.2;101;-;-;1
30/11/2015 0:00;2015;11;30;16;35;40;0.82;50;10;24;5;101;-;-;1
31/11/2015 0:00;2015;11;31;19.5;35.5;38.5;1.08;50;10.5;27;5.1;102;2015 11 31;2015 12 6;2
01/12/2015 0:00;2015;12;1;23;36;37;1.34;50;11;30;5.2;102;-;-;2
02/12/2015 0:00;2015;12;2;28;62;54;1.27;52;11;28;5;102;-;-;2
03/12/2015 0:00;2015;12;3;8;56;57;0.39;56;8;15;3;102;-;-;2
04/12/2015 0:00;2015;12;4;5;11;25;0.24;29;29;20;4.2;102;-;-;2
05/12/2015 0:00;2015;12;5;7;21;32;0.7;34;12;21;4.6;102;-;-;2
06/12/2015 0:00;2015;12;6;11;20;34;0.74;40;11;24;4.9;102;-;-;2
07/12/2015 0:00;2015;12;7;9;27;47;1.19;42;11;14;3.7;103;2015 12 7;2015 12 13;3
08/12/2015 0:00;2015;12;8;3;6;27;0.27;29;25;17;3.6;103;-;-;3
09/12/2015 0:00;2015;12;9;5;16;21;0.38;32;15;18;2.8;103;-;-;3
10/12/2015 0:00;2015;12;10;15;23;27;1;38;9;23;4.2;103;-;-;3
11/12/2015 0:00;2015;12;11;11;27;31;0.26;46;11;25;4.9;103;-;-;3
12/12/2015 0:00;2015;12;12;16;34;36;1.44;50;8;18;4.5;103;-;-;3
13/12/2015 0:00;2015;12;13;11;46;50;1.59;36;12;11;3;103;-;-;3
14/12/2015 0:00;2015;12;14;8;36;42;0.28;17;22;16;3.8;104;2015 12 14;2015 12 20;4
15/12/2015 0:00;2015;12;15;11;61;47;0.58;48;15;28;6.3;104;-;-;4
16/12/2015 0:00;2015;12;16;8;52;47;0.51;67;6;24;5.7;104;-;-;4
17/12/2015 0:00;2015;12;17;15;64;57;0.63;82;10;38;7.9;104;-;-;4
18/12/2015 0:00;2015;12;18;12;67;49;0.51;84;6;18;5.5;104;-;-;4
19/12/2015 0:00;2015;12;19;8;46;47;0.6;77;19;17;5.5;104;-;-;4
20/12/2015 0:00;2015;12;20;4;11;31;0.26;34;29;23;6.2;104;-;-;4
21/12/2015 0:00;2015;12;21;16;19;34;1.04;50;9;21;6.2;105;2015 12 21;2015 12 27;1
22/12/2015 0:00;2015;12;22;23;45;50;1.81;62;11;15;1.7;105;-;-;1
23/12/2015 0:00;2015;12;23;4;16;28;0.27;35;24;24;3;105;-;-;1
24/12/2015 0:00;2015;12;24;8;36;35;0.51;45;8;13;2.1;105;-;-;1
25/12/2015 0:00;2015;12;25;8;8;21;0.38;34;16;12;1.8;105;-;-;1
26/12/2015 0:00;2015;12;26;9;7;23;0.69;24;23;21;2;105;-;-;1
27/12/2015 0:00;2015;12;27;13;12;32;0.68;29;22;15;0.8;105;-;-;1
28/12/2015 0:00;2015;12;28;5;3;18;0.42;29;52;23;2.9;106;2015 12 28;2016 1 3;2
29/12/2015 0:00;2015;12;29;6;21;28;0.69;46;11;9;1.1;106;-;-;2
30/12/2015 0:00;2015;12;30;5;22;28;0.18;31;31;11;1.4;106;-;-;2
31/12/2015 0:00;2015;12;31;8;9;23;0.33;26;20;7;0.9;106;-;-;2